{
  "schema": 1,
  "name": "FireworksRecipes",
  "description": "Fireworks 配方目录。每条对应一个可一键安装并发布到 DGX Spark 集群的模型配方；nodes 为固定拓扑，发布时必须恰好匹配。",
  "description_en": "Fireworks recipe catalog. Each entry is a model recipe you can install and publish to a DGX Spark cluster with one click; nodes declare a fixed topology you must match exactly.",
  "recipes": [
    {
      "id": "deepseek-v4-flash-dspark",
      "provider": "deepseek-ai",
      "model": "deepseek-ai/DeepSeek-V4-Flash-0731",
      "path": "recipes/deepseek-v4-flash-dspark/fireworks.recipe.json",
      "readme": "recipes/deepseek-v4-flash-dspark/README.md",
      "readme_en": "recipes/deepseek-v4-flash-dspark/README.en.md",
      "version": "1.5.0",
      "params": "284B/13B",
      "context_length": 1048576,
      "modality": "text",
      "nodes": 2,
      "image": "registry.cn-shanghai.aliyuncs.com/aixn-public/dspark-vllm-gx10-mia:v0.1.1-hotfix7",
      "tags": [
        "gb10",
        "dspark",
        "anemll",
        "vllm",
        "1m-context",
        "mia-hotfix"
      ],
      "description": "DeepSeek-V4-Flash 双节点 TP=2 DSpark 服务：Anemll 分发镜像、FlashInfer b12x + dspark 投机、NVFP4 DS-MLA、1M 上下文，默认思考 low。",
      "description_en": "2-node TP=2 DSpark serving for DeepSeek-V4-Flash: Anemll distribution image, FlashInfer b12x + dspark speculation, NVFP4 DS-MLA, 1M context, default thinking low.",
      "name": "DeepSeek-V4-Flash MiaAI-Lab",
      "name_en": "DeepSeek-V4-Flash MiaAI-Lab"
    },
    {
      "id": "deepseek-v4-flash-vision-exp-dspark",
      "provider": "deepseek-ai",
      "model": "deepseek-ai/DeepSeek-V4-Flash-Vision-Exp",
      "path": "recipes/deepseek-v4-flash-vision-exp-dspark/fireworks.recipe.json",
      "readme": "recipes/deepseek-v4-flash-vision-exp-dspark/README.md",
      "readme_en": "recipes/deepseek-v4-flash-vision-exp-dspark/README.en.md",
      "version": "1.3.0",
      "params": "305B（含 ViT/Aligner）",
      "context_length": 1048576,
      "modality": "image-text-to-text",
      "nodes": 2,
      "image": "registry.cn-shanghai.aliyuncs.com/aixn-public/dspark-vllm-gx10-mia:v0.1.1-hotfix7",
      "tags": [
        "gb10",
        "dspark",
        "anemll",
        "vllm",
        "vision-exp",
        "multimodal",
        "1m-context",
        "mia-hotfix"
      ],
      "description": "DeepSeek-V4-Flash-Vision-Exp 双节点 TP=2 DSpark 服务：Anemll 分发镜像、原生图片输入（ViT+Aligner 启动热修复，含上游 #168/#176/#179 vision 修复与 09-05 image-cap 修复，OpenAI image_url ≤8 张/仅 user 消息/无视频）、FlashInfer b12x + dspark 投机 k=6、NVFP4 DS-MLA、1M 上下文，默认思考 low。",
      "description_en": "2-node TP=2 DSpark serving for DeepSeek-V4-Flash-Vision-Exp: Anemll distribution image, native image input (ViT+Aligner startup hotfix, incl. upstream #168/#176/#179 vision fixes and the 09-05 image-cap fix, OpenAI image_url up to 8/user messages only/no video), FlashInfer b12x + dspark speculation k=6, NVFP4 DS-MLA, 1M context, default thinking low.",
      "name": "DeepSeek-V4-Flash-Vision-Exp MiaAI-Lab",
      "name_en": "DeepSeek-V4-Flash-Vision-Exp MiaAI-Lab"
    },
    {
      "id": "deepseek-v4-flash-0731-tp4-4x",
      "provider": "deepseek-ai",
      "model": "deepseek-ai/DeepSeek-V4-Flash-0731",
      "path": "recipes/deepseek-v4-flash-0731-tp4-4x/fireworks.recipe.json",
      "readme": "recipes/deepseek-v4-flash-0731-tp4-4x/README.md",
      "readme_en": "recipes/deepseek-v4-flash-0731-tp4-4x/README.en.md",
      "version": "1.0.0",
      "params": "284B/13B",
      "context_length": 1048576,
      "modality": "text",
      "nodes": 4,
      "image": "ghcr.io/anemll/dspark-vllm-gx10:0.1.1",
      "tags": [
        "gb10",
        "dspark",
        "anemll",
        "vllm",
        "tp4",
        "1m-context",
        "agentic"
      ],
      "description": "DeepSeek-V4-Flash-0731 四节点 TP=4 DSpark 服务：Anemll 分发镜像、FlashInfer b12x + dspark 投机 k=5、NVFP4 DS-MLA、1M 上下文（agentic 工作负载实机验证）。",
      "description_en": "4-node TP=4 DSpark serving for DeepSeek-V4-Flash-0731: Anemll distribution image, FlashInfer b12x + dspark speculation k=5, NVFP4 DS-MLA, 1M context (verified on a real agentic workload).",
      "name": "DeepSeek-V4-Flash DSpark TP=4",
      "name_en": "DeepSeek-V4-Flash DSpark TP=4"
    },
    {
      "id": "deepseek-v4-flash-0731-spark-b12x",
      "provider": "deepseek-ai",
      "model": "deepseek-ai/DeepSeek-V4-Flash-0731",
      "path": "recipes/deepseek-v4-flash-0731-spark-b12x/fireworks.recipe.json",
      "readme": "recipes/deepseek-v4-flash-0731-spark-b12x/README.md",
      "readme_en": "recipes/deepseek-v4-flash-0731-spark-b12x/README.en.md",
      "version": "1.1.0",
      "params": "284B/13B",
      "context_length": 1048576,
      "modality": "text",
      "nodes": 2,
      "image": "registry.cn-shanghai.aliyuncs.com/aixn-public/spark-vllm-b12x:v1.0.0",
      "tags": [
        "gb10",
        "spark-vllm",
        "b12x",
        "vllm",
        "dspark",
        "1m-context",
        "fp8",
        "aot-compile"
      ],
      "description": "DeepSeek-V4-Flash-0731 双节点 TP=2 Spark-vLLM 服务：aixn-public 自烘焙 spark-vllm-b12x 镜像（eugr nightly-20260909 基 + hybrid-draft-loader patch）、B12X 注意力 + b12x MoE/线性层、dspark 投机 k=5、FP8 KV 缓存、instanttensor 加载 + AOT 编译、1M 上下文（对齐上游 09-03 新 b12x 分支）。",
      "description_en": "2-node TP=2 Spark-vLLM serving for DeepSeek-V4-Flash-0731: aixn-public baked spark-vllm-b12x image (eugr nightly-20260909 base + hybrid-draft-loader patch), B12X attention + b12x MoE/linear, dspark speculation k=5, FP8 KV cache, instanttensor load with AOT compile, 1M context (aligned with the upstream 09-03 new b12x branch).",
      "name": "DeepSeek-V4-Flash Spark-vLLM b12x",
      "name_en": "DeepSeek-V4-Flash Spark-vLLM b12x"
    },
    {
      "id": "deepseek-v4-flash-vision-exp-spark-b12x",
      "provider": "deepseek-ai",
      "model": "deepseek-ai/DeepSeek-V4-Flash-Vision-Exp",
      "path": "recipes/deepseek-v4-flash-vision-exp-spark-b12x/fireworks.recipe.json",
      "readme": "recipes/deepseek-v4-flash-vision-exp-spark-b12x/README.md",
      "readme_en": "recipes/deepseek-v4-flash-vision-exp-spark-b12x/README.en.md",
      "version": "1.0.0",
      "params": "305B（含 ViT/Aligner）",
      "context_length": 1048576,
      "modality": "image-text-to-text",
      "nodes": 2,
      "image": "registry.cn-shanghai.aliyuncs.com/aixn-public/spark-vllm-b12x:v1.0.0",
      "tags": [
        "gb10",
        "spark-vllm",
        "b12x",
        "vllm",
        "vision-exp",
        "multimodal",
        "1m-context",
        "fp8",
        "aot-compile",
        "dspark"
      ],
      "description": "DeepSeek-V4-Flash-Vision-Exp 双节点 TP=2 Spark-vLLM 服务：aixn-public 自烘焙 spark-vllm-b12x 镜像（eugr nightly-20260909 基 + hybrid-draft-loader patch，--exp-b12x 视觉构建）、B12X 注意力 + b12x MoE/线性层、dspark 投机 k=6、FP8 KV 缓存、instanttensor 加载 + AOT 编译、1M 上下文。",
      "description_en": "2-node TP=2 Spark-vLLM serving for DeepSeek-V4-Flash-Vision-Exp: aixn-public baked spark-vllm-b12x image (eugr nightly-20260909 base + hybrid-draft-loader patch, --exp-b12x vision build), B12X attention + b12x MoE/linear, dspark speculation k=6, FP8 KV cache, instanttensor load with AOT compile, 1M context.",
      "name": "DeepSeek-V4-Flash-Vision-Exp Spark-vLLM b12x",
      "name_en": "DeepSeek-V4-Flash-Vision-Exp Spark-vLLM b12x"
    },
    {
      "id": "qwen38-flash-next-single-dgx-spark",
      "provider": "qwen",
      "model": "Mia-AiLab/Qwen3.8-Flash-Next-NVFP4",
      "path": "recipes/qwen38-flash-next-single-dgx-spark/fireworks.recipe.json",
      "readme": "recipes/qwen38-flash-next-single-dgx-spark/README.md",
      "readme_en": "recipes/qwen38-flash-next-single-dgx-spark/README.en.md",
      "version": "1.3.0",
      "params": "176.9B（51.2B PLE 表 NVMe 离载）/ NVFP4",
      "context_length": 262144,
      "modality": "image-text-to-text",
      "nodes": 1,
      "image": "registry.cn-shanghai.aliyuncs.com/aixn-public/qwen38-flash-next:v1.2.0",
      "tags": [
        "gb10",
        "qwen3.8",
        "flash-next",
        "vllm",
        "nvfp4",
        "ple-offload",
        "mtp",
        "single-node",
        "262k-context",
        "multimodal",
        "miaai-lab",
        "draft-vocab"
      ],
      "description": "Qwen3.8-Flash-Next（176.9B，Mia-AiLab NVFP4 checkpoint ~99 GB）单节点 TP=1 vLLM 服务（1× DGX Spark）：26.82 GiB n-gram/PLE 查找表由 NVMe 内存映射离载（VLLM_PLE_CPU_OFFLOAD=1 + MADV_RANDOM + PLE prefetch，每 token 磁盘读 1,366→57 KiB）、MTP 训练草稿 k=3 投机 + 可选 reduced-vocabulary drafting（MTP_DRAFT_VOCAB，+25% decode）、FP8 KV（≈1.85× KV 池，→512k 下 2.73× 满请求）、BF16 GDN/SSM 常驻状态 + V2 runner 固定（上游 09-06 shipped）、262,144 原生上下文（YARN=1 → 524,288 YaRN）、宿主侧 HOST_RESERVE 封顶 GPU 预算（KV_TARGET_GIB 20 → GMU 0.786）、推理默认开（reasoning 字段单独返回、可每请求关）、OpenAI API + 图片/视频多模态；sparkDash 实测 decode 单流 ~46–49 tok/s（4 流聚合 108–114、8 流 162.9）、prefill 峰值 ~2,265 tok/s @32k。源自 MiaAI-Lab/Qwen3.8-Flash-Next-Single-DGX-Spark（AGPL-3.0 配方参考）。",
      "description_en": "Single-node TP=1 vLLM serving for Qwen3.8-Flash-Next (176.9B, Mia-AiLab NVFP4 checkpoint ~99 GB) on one DGX Spark: the 26.82 GiB n-gram/PLE lookup table is offloaded and memory-mapped from NVMe (VLLM_PLE_CPU_OFFLOAD=1 + MADV_RANDOM + PLE prefetch, 1,366 -> 57 KiB disk read per token), MTP trained-draft k=3 speculation with optional reduced-vocabulary drafting (MTP_DRAFT_VOCAB, +25% decode), FP8 KV (~1.85x KV pool, -> 2.73x a full request at 512k), BF16 GDN/SSM recurrent state + V2 runner pinned (upstream 09-06 shipped), 262,144 native context (YARN=1 -> 524,288 YaRN), host-side HOST_RESERVE caps the GPU budget (KV_TARGET_GIB 20 -> GMU 0.786), reasoning on by default (separate reasoning field, disable per request), OpenAI API with image/video multimodal; measured with sparkDash - decode ~46-49 tok/s single-stream (108-114 aggregate at 4, 162.9 at 8), prefill peak ~2,265 tok/s @32k. Ported from MiaAI-Lab/Qwen3.8-Flash-Next-Single-DGX-Spark (AGPL-3.0 reference).",
      "name": "Qwen3.8-Flash-Next（单节点 TP=1 · MiaAI-Lab）",